{
  "$schema": "https://json-schema.org/draft/2020-12/schema",
  "$id": "https://schemas.aas.invalid/private/v0/artifact-manifest.schema.json",
  "title": "AAS normative artifact manifest",
  "x-aas-status": "private-provisional-unpublished",
  "$defs": {
    "manifestPath": {
      "type": "string",
      "minLength": 1,
      "maxLength": 4096,
      "pattern": "^(?:decisions/README\\.md|(?!.*(?:^|/)(?:con|prn|aux|nul|clock\\$|conin\\$|conout\\$|com[1-9]|lpt[1-9])(?:\\.|/|$))(?!.*[. ](?:/|$))[a-z0-9][a-z0-9._-]*(?:/[a-z0-9][a-z0-9._-]*)*)$"
    }
  },
  "type": "object",
  "additionalProperties": false,
  "required": ["manifestVersion", "standardVersion", "status", "schemaDialect", "identityPolicy", "artifacts"],
  "properties": {
    "manifestVersion": { "const": "1" },
    "standardVersion": { "$ref": "common.schema.json#/$defs/canonicalSemVer" },
    "status": { "const": "provisional-unpublished" },
    "schemaDialect": { "const": "https://json-schema.org/draft/2020-12/schema" },
    "identityPolicy": {
      "type": "object",
      "additionalProperties": false,
      "required": ["contentDigest", "aasIdentity"],
      "properties": {
        "contentDigest": { "const": "raw-sha256-over-exact-content-bytes" },
        "aasIdentity": { "const": "domain-framed-identity-deferred-to-phase-2" }
      }
    },
    "artifacts": {
      "type": "array", "minItems": 1, "maxItems": 10000,
      "items": {
        "type": "object", "additionalProperties": false,
        "required": ["path", "class", "contentDigest", "aasIdentityStatus", "byteLength", "mediaType"],
        "properties": {
          "path": { "$ref": "#/$defs/manifestPath" },
          "class": { "enum": ["schema", "registry", "vector", "normative-prose", "generated-declaration", "version-matrix"] },
          "schemaId": { "type": "string", "format": "uri" },
          "contentDigest": { "$ref": "common.schema.json#/$defs/contentDigest" },
          "aasIdentityStatus": { "const": "not-computed-phase-1" },
          "byteLength": { "type": "integer", "minimum": 0, "maximum": 9007199254740991 },
          "mediaType": { "type": "string", "minLength": 1, "maxLength": 127 }
        }
      }
    }
  }
}
