{
  "manifestVersion": "1",
  "standardVersion": "0.1.0-rc.1",
  "status": "provisional-unpublished",
  "schemaDialect": "https://json-schema.org/draft/2020-12/schema",
  "identityPolicy": {
    "contentDigest": "raw-sha256-over-exact-content-bytes",
    "aasIdentity": "domain-framed-identity-deferred-to-phase-2"
  },
  "artifacts": [
    {
      "path": "decisions/phase-0-d0-d11-v2.md",
      "class": "normative-prose",
      "contentDigest": "sha256:2815ce512740fe0f1abc81660243bb1a19ed940f54ee83ad53570dde3a2c2a7d",
      "aasIdentityStatus": "not-computed-phase-1",
      "byteLength": 3760,
      "mediaType": "text/markdown"
    },
    {
      "path": "generated/artifact-manifest.d.ts",
      "class": "generated-declaration",
      "contentDigest": "sha256:ca2d036eb036c09da6322b5f83a856146a6252c636fd16a0ad4f5fd25737f281",
      "aasIdentityStatus": "not-computed-phase-1",
      "byteLength": 1188,
      "mediaType": "text/typescript"
    },
    {
      "path": "generated/artifacts.d.ts",
      "class": "generated-declaration",
      "contentDigest": "sha256:f84670d9f465815742ea96097af84c0dbd50682561748e80464ae1f66bdcd817",
      "aasIdentityStatus": "not-computed-phase-1",
      "byteLength": 2238,
      "mediaType": "text/typescript"
    },
    {
      "path": "generated/common.d.ts",
      "class": "generated-declaration",
      "contentDigest": "sha256:be7590513f11998eca6b169ae92426cc23026623b3a7b806b53ab0304ccdd2e8",
      "aasIdentityStatus": "not-computed-phase-1",
      "byteLength": 2023,
      "mediaType": "text/typescript"
    },
    {
      "path": "generated/conformance.d.ts",
      "class": "generated-declaration",
      "contentDigest": "sha256:e63d2e3e11661cd39951617600f156e5d8f06272c969a47b15c943971a4d6f1f",
      "aasIdentityStatus": "not-computed-phase-1",
      "byteLength": 7426,
      "mediaType": "text/typescript"
    },
    {
      "path": "generated/envelope.d.ts",
      "class": "generated-declaration",
      "contentDigest": "sha256:b1aa0f71e5b2ec9c07d8186dfe28a6f372141171c071bcae653865fbf049c390",
      "aasIdentityStatus": "not-computed-phase-1",
      "byteLength": 13085,
      "mediaType": "text/typescript"
    },
    {
      "path": "generated/identity-documents.d.ts",
      "class": "generated-declaration",
      "contentDigest": "sha256:5dc41c60a443e690083ca4dad7ec11102d7292471b2f832d83fc9788c82e5d6c",
      "aasIdentityStatus": "not-computed-phase-1",
      "byteLength": 4249,
      "mediaType": "text/typescript"
    },
    {
      "path": "generated/overlay.d.ts",
      "class": "generated-declaration",
      "contentDigest": "sha256:45504506353ef91a9b1916b90969eed4badd92bf01d28ebd7bcf24a94fa3e2b2",
      "aasIdentityStatus": "not-computed-phase-1",
      "byteLength": 1758,
      "mediaType": "text/typescript"
    },
    {
      "path": "generated/policy.d.ts",
      "class": "generated-declaration",
      "contentDigest": "sha256:067115aa9ae1718ebc563eae0868800714e3db9d54ef341bb6bc5ac66ba706b6",
      "aasIdentityStatus": "not-computed-phase-1",
      "byteLength": 3783,
      "mediaType": "text/typescript"
    },
    {
      "path": "generated/provider.d.ts",
      "class": "generated-declaration",
      "contentDigest": "sha256:1e0070151074f3e0f5b89794ade3fb44c35b3af0a361bcc0fa596b98290b23b5",
      "aasIdentityStatus": "not-computed-phase-1",
      "byteLength": 903,
      "mediaType": "text/typescript"
    },
    {
      "path": "generated/registry.d.ts",
      "class": "generated-declaration",
      "contentDigest": "sha256:0faf6f6519a5addd5dcd62d5dfb1bc46276b334dcce36a767fcf70f583a95c1b",
      "aasIdentityStatus": "not-computed-phase-1",
      "byteLength": 2899,
      "mediaType": "text/typescript"
    },
    {
      "path": "registries/actions.json",
      "class": "registry",
      "contentDigest": "sha256:523194a4dfa1b37132aa2f37b69158a95db3620f42bfc7481883f8765e65a145",
      "aasIdentityStatus": "not-computed-phase-1",
      "byteLength": 569,
      "mediaType": "application/json"
    },
    {
      "path": "registries/diagnostics.json",
      "class": "registry",
      "contentDigest": "sha256:d2c5bcb03d61f5ac0f11de975d4050b447fafcb8e2470c305b813c39f015f680",
      "aasIdentityStatus": "not-computed-phase-1",
      "byteLength": 5108,
      "mediaType": "application/json"
    },
    {
      "path": "registries/envelope-versions.json",
      "class": "registry",
      "contentDigest": "sha256:8e5ddd552ccd7c4716a79d7bf8e964646b739c8818649a3eacf11f286bfed841",
      "aasIdentityStatus": "not-computed-phase-1",
      "byteLength": 701,
      "mediaType": "application/json"
    },
    {
      "path": "registries/extensions.json",
      "class": "registry",
      "contentDigest": "sha256:a8973805ff5cf40cdc73c02593abe03cc417306002f8c8f0858caad5808dd097",
      "aasIdentityStatus": "not-computed-phase-1",
      "byteLength": 234,
      "mediaType": "application/json"
    },
    {
      "path": "registries/operations.json",
      "class": "registry",
      "contentDigest": "sha256:15eefc8942280368ad7bf23b1a5c534ce36c1bceda6567a6c5587b1fd8f1cfce",
      "aasIdentityStatus": "not-computed-phase-1",
      "byteLength": 705,
      "mediaType": "application/json"
    },
    {
      "path": "registries/problems.json",
      "class": "registry",
      "contentDigest": "sha256:cf3f1143806f58bcc651ca44de290cdabc61e52b9a61e80047a9bf273f2e46d6",
      "aasIdentityStatus": "not-computed-phase-1",
      "byteLength": 544,
      "mediaType": "application/json"
    },
    {
      "path": "registries/profiles.json",
      "class": "registry",
      "contentDigest": "sha256:c594bfaeb6630e0145259c6e3cc0446c82fded7cd9a5261f13d6cb8657a41c71",
      "aasIdentityStatus": "not-computed-phase-1",
      "byteLength": 1426,
      "mediaType": "application/json"
    },
    {
      "path": "registries/readme.md",
      "class": "normative-prose",
      "contentDigest": "sha256:4107f15c4a2b4ab1a2b2ca460c2bb97388783d74a1508f2b52dad4318ff79d14",
      "aasIdentityStatus": "not-computed-phase-1",
      "byteLength": 3192,
      "mediaType": "text/markdown"
    },
    {
      "path": "registries/resolutions.json",
      "class": "registry",
      "contentDigest": "sha256:f348c64e7e31cf0014cc709a8039d122a68f41d5655fef63ab92a1f6a7373086",
      "aasIdentityStatus": "not-computed-phase-1",
      "byteLength": 1773,
      "mediaType": "application/json"
    },
    {
      "path": "schemas/artifact-manifest.schema.json",
      "class": "schema",
      "contentDigest": "sha256:370208ad86188030076622f9da92f553163e694a579a99ea726d4a1de2919eb8",
      "aasIdentityStatus": "not-computed-phase-1",
      "byteLength": 2174,
      "mediaType": "application/json",
      "schemaId": "https://schemas.aas.invalid/private/v0/artifact-manifest.schema.json"
    },
    {
      "path": "schemas/artifacts.schema.json",
      "class": "schema",
      "contentDigest": "sha256:5f4021428d6fd1d3d66992219152a682867fad96becfd3668f98d5e4878f0ea7",
      "aasIdentityStatus": "not-computed-phase-1",
      "byteLength": 4609,
      "mediaType": "application/json",
      "schemaId": "https://schemas.aas.invalid/private/v0/artifacts.schema.json"
    },
    {
      "path": "schemas/common.schema.json",
      "class": "schema",
      "contentDigest": "sha256:af98f96ffb62caa2b86cbd0ea98c531ccede93c71a560c915c332d2bd99fed2b",
      "aasIdentityStatus": "not-computed-phase-1",
      "byteLength": 5272,
      "mediaType": "application/json",
      "schemaId": "https://schemas.aas.invalid/private/v0/common.schema.json"
    },
    {
      "path": "schemas/conformance.schema.json",
      "class": "schema",
      "contentDigest": "sha256:dbf91924ee1aa220dc6d447403132f45d1807435658f7d8c90b4a37b1ef3ee0f",
      "aasIdentityStatus": "not-computed-phase-1",
      "byteLength": 16386,
      "mediaType": "application/json",
      "schemaId": "https://schemas.aas.invalid/private/v0/conformance.schema.json"
    },
    {
      "path": "schemas/envelope.schema.json",
      "class": "schema",
      "contentDigest": "sha256:d409cf8a8f3727dbd2df1f554abbef18df5f3f36cd66c59f155920525918e2bd",
      "aasIdentityStatus": "not-computed-phase-1",
      "byteLength": 15599,
      "mediaType": "application/json",
      "schemaId": "https://schemas.aas.invalid/private/v0/envelope.schema.json"
    },
    {
      "path": "schemas/identity-documents.schema.json",
      "class": "schema",
      "contentDigest": "sha256:a1b8564b80a570a3b4e0957d1b1abe8228120c6a3e3127d1f3aaf875c437f24d",
      "aasIdentityStatus": "not-computed-phase-1",
      "byteLength": 8568,
      "mediaType": "application/json",
      "schemaId": "https://schemas.aas.invalid/private/v0/identity-documents.schema.json"
    },
    {
      "path": "schemas/overlay.schema.json",
      "class": "schema",
      "contentDigest": "sha256:ed8c372d44419e3bb104e0c3cddd2d186fe7ea7faea9ef1017f56b75f735629d",
      "aasIdentityStatus": "not-computed-phase-1",
      "byteLength": 3205,
      "mediaType": "application/json",
      "schemaId": "https://schemas.aas.invalid/private/v0/overlay.schema.json"
    },
    {
      "path": "schemas/policy.schema.json",
      "class": "schema",
      "contentDigest": "sha256:24af7d17044e328c0aaa3287d1cce4941041d2060d9606c7a7215eae82ff153a",
      "aasIdentityStatus": "not-computed-phase-1",
      "byteLength": 5855,
      "mediaType": "application/json",
      "schemaId": "https://schemas.aas.invalid/private/v0/policy.schema.json"
    },
    {
      "path": "schemas/provider.schema.json",
      "class": "schema",
      "contentDigest": "sha256:1719f7b92da4783a44068e327aee0f4b5e64c91ec45f20b60b6eca2f0796b374",
      "aasIdentityStatus": "not-computed-phase-1",
      "byteLength": 1348,
      "mediaType": "application/json",
      "schemaId": "https://schemas.aas.invalid/private/v0/provider.schema.json"
    },
    {
      "path": "schemas/readme.md",
      "class": "normative-prose",